{
  "apiVersion": "controller.embed-labs.dev/v1",
  "kind": "AdapterManifest",
  "metadata": {
    "id": "mock.adapter.analog-io.4x4",
    "version": "1.0.0",
    "createdAt": "2026-07-25T00:00:00Z",
    "description": "Mock-only exact-ESI adapter for the analog I/O fixture"
  },
  "spec": {
    "validationState": "mock-only",
    "origin": "exact-esi",
    "matchPriority": 800,
    "identityScope": {
      "vendorId": 286331153,
      "productCode": 4098,
      "minimumRevision": 1,
      "maximumRevision": 1
    },
    "esiSha256": [
      "7c0ba0e8736dafbaf1b9ab00bac2920b3b5a4e1c660b62e81a4cec9a836ff106"
    ],
    "deviceModel": {
      "id": "mock.analog-io.4x4",
      "version": "1.0.0",
      "sha256": "bf4438cfef08b787fa22adb4c845875274cf384df2544534c8b7afeb2ecfdd01"
    },
    "capabilities": [
      "analog-input",
      "analog-output",
      "coe",
      "diagnostics"
    ],
    "privateInitializationStatus": "not-required",
    "evidence": [
      {
        "kind": "schema-validation",
        "result": "passed",
        "artifactSha256": "bf4438cfef08b787fa22adb4c845875274cf384df2544534c8b7afeb2ecfdd01",
        "uri": "mock://evidence/issue-ai-controller-001/analog-io",
        "recordedAt": "2026-07-25T00:00:00Z",
        "notes": "Offline schema and semantic fixture qualification only."
      }
    ],
    "signature": null,
    "realHardwareAllowed": false
  }
}
