{
  "apiVersion": "controller.embed-labs.dev/v1",
  "kind": "AdapterManifest",
  "metadata": {
    "id": "mock.adapter.digital-io.8x8",
    "version": "1.0.0",
    "createdAt": "2026-07-25T00:00:00Z",
    "description": "Mock-only exact-ESI adapter for the digital I/O fixture"
  },
  "spec": {
    "validationState": "mock-only",
    "origin": "exact-esi",
    "matchPriority": 800,
    "identityScope": {
      "vendorId": 286331153,
      "productCode": 4097,
      "minimumRevision": 1,
      "maximumRevision": 1
    },
    "esiSha256": [
      "2f9adb1d95f34114fdf6018e849984e62f9846e491d5f5ffed85d8d6928ba940"
    ],
    "deviceModel": {
      "id": "mock.digital-io.8x8",
      "version": "1.0.0",
      "sha256": "5ba99f7fe7e42559dbe68f422915a98d291065f3b95f0b6bb2afbe65fac2f7da"
    },
    "capabilities": [
      "digital-input",
      "digital-output",
      "coe",
      "diagnostics"
    ],
    "privateInitializationStatus": "not-required",
    "evidence": [
      {
        "kind": "schema-validation",
        "result": "passed",
        "artifactSha256": "5ba99f7fe7e42559dbe68f422915a98d291065f3b95f0b6bb2afbe65fac2f7da",
        "uri": "mock://evidence/issue-ai-controller-001/digital-io",
        "recordedAt": "2026-07-25T00:00:00Z",
        "notes": "Offline schema and semantic fixture qualification only."
      }
    ],
    "signature": null,
    "realHardwareAllowed": false
  }
}
